,0
324,"꾸준히 쓰고 있어요. 발랐을 때랑 안 발랐을 때가 확연히 달라요. 
피부가 거칠고 트러블이 자주 일어날 때 자기 전에 바르면 아침에 진정된게 눈에 보여요.
프로폴리스 성분은 어떤 형태의 화장품이든 믿고 사는 편인데 차앤박 플로폴리스 앰플은 그 중에서도 독보적으로 좋아요."
325,계속 써봐야 알겟지만... 피부가 좋아지는 효과는 딱히 모르겠어요 아직 ㅠㅠ
326,"촉촉해서 만족합니다
재구매 했습니다
얼굴도 하얘지는 느낌"
327,매년 몇병씩 쟁여놓고 쓸 정도로 좋아하는 앰플이에요. 기획 세트로 너무 만족합니다!
328,후기보고서 구매해봤는데 피부도 쫀쫀해지는것같고 마음에듭니다
329,엄마가 정말 좋아하시네요 무겁자도 않고 가볍지도 않아요
330,"항상 유수분 밸런스가 고민거리였습니다ㅠㅠ 처음엔 너무 번들거리거나 기름질까봐 걱정했지만 리뷰들 보면서 긴가민가하면서 샀어요! 처음 바른 직후는 확실히 딱 앰플의 느낌, 광이 나는데 시간이 좀 지나니까 금방 촉촉하게 잘 흡수됐어요! 걱정했던 게 무색할 정도로 촉촉하게 흡수된 후에 전혀 끈적이지도 않고 피부가 힘을 얻는 느낌?이어서 앞으로도 믿고 쓸 것 같아요❤️"
331,선물용으로 주문했는데 받으시는분이 만족하네요.
332,보습력 좋고 성분도 좋아서 민감하고 건조한 제 피부에도 자극없이 잘 맞아요~!
333,여러개 쟁여놓고 쓰는 겨울에 필수 앰플입니다!
334,맨날쓰던거라 세일하길래 쟁여놓아요~ 세일 자주해주면 좋겠어요 가격이 좀 많이 비싸서 ㅠㅠ
335,"이것저것 사용해보다가 정착한 지 n년째,, 순하면서도 촉촉하고 향도 좋아서 계속 쓰는 중이에요. 트러블 진정이나 보습 다 좋아서 가격 대비 저렴한 다른 걸로 바꿔볼까 해도 이것보다 좋은 걸 못 찾았어요. 프로폴리스앰플은 사용 중인 게 남아있어도 세일할 때면 무조건 쟁여둡니다!"
336,많은 사람들이 쓰는 이유가 분명 있겠지여??ㅎ
337,기획 나와서  얼른 구매 했어요 매상에서  사용했는데 촉촉 하니 좋아서 구매 했습니다
338,피부흡수도 좋고 촉촉하니 보습도 좋 만족합니다
339,행사할 때 저렴하게 잘 구매한 것 같아요!!평소에 너무 써보고 싶었는데 살까말까 고민고민 하다가 마침 행사하길래 바로 질렀어요!! 전혀 후회 없이 너무너무 잘 사용하고 있어서 만족하고 있습니다아아아 그리고 혹시 저처럼 고민하고 계신 분이 있으시면 전혀 고민하지 마시구 꼭 지르시기를 추천드립니다!! 강추강추 입니다!!
340,앰플은 차앤박이죠 이거랑 팩트같이 조합해서 화장하면 환상
341,어머니한테 선물 드렸는데 너무너무 좋아하세요!!
342,좋아요 ㅎㅎㅎ 이 제품 자주 쓰는데 자극없고 좋아요
343,"이런 구성은 처음이라 구매했어요 
속건조에 너무 좋고 흡수도 잘되요"
344,"촉촉함이 오래가서 좋아요
피부에 영양을 꽉 채워주는거같아요"
345,세일해서 너무 저렴한 가격에 구입했어요! 마음에 듭니다. 촉촉하고 쫀쫀해져요.
346,항상 애용하는거라  몇개씩 사놓고 바릅니다. 펑펑 써도 가격이 착한편이라 만족해요. 나이가 있다보니 명품 화장품.방판 화장품만 썼는데 가격이 저렴하다고 효능까지 떨어지는건 아니더라구요.  앰플만 쓰다가 크림도 좋아서 바꿨어요. 건성이면 데일리 쓰기 괜찮고 복합성. 지성엔 데이. 나잇 다써도 좋을듯해요.
347,"상품평도 너무 좋고 기획도 너무 잘나왔다길래 한번 구매해봤는데 너무 맘에드네요 
앰플 어떤건 너무 무거워서 바르고나면 머리카락 붙고 불편한 느낌이 드는데 요건 너무 가볍지도 무겁지도 않고 흡수도 잘돼서 마무리감이 좋은거 같아요 
바르고나면 촉촉하고 쫀쫀한느낌!
근데 제가 극건성은 아닌데도 스킨하고 요것만 바르면 다 흡수됐을때 좀 건조한 느낌이 있어서 가벼운 크림이나 로션 한번 더 발라주면 피부도 편하고 딱 좋았어요"
348,정말 와 차앤박 차앤박 하는지 알 것 같은 제품이었어요.
349,무난한 타입의 앰플입니다~~~~!!!! 꾸준히 써봐야 될 거 같아오
350,흡수율이 빠르네요. 다른걸로 인해.밀리지도 않고 약간 독특한 향이 나네요
351,"특히 찬바람 부는 계절에 사용하는 상품입니다.
쫀쫀하고 영양감이 있는 느낌이라 저는 좋은데 무겁고 찐득한 느낌을 싫어하시는 분은 별로라 할것같아요"
352,"와! 사람들이 많이 사용하는줄 알겠어요! 할인이 많이 되서 구매해봤는데, 처음 발랐을때 쫀쫀함을 잊지 못할거 같아요.. 다 사용하면 꼭 다시 재구매 할거에요!"
353,"나이가 드니 건조해지고 주름이 깊어지고 쳐짐이 느껴지는게
피부탄력의 문제인가 싶어요
그래서 행사도 하길래 사봤어요
6만원대인데 거의 50퍼할인 행사한거같아요
바르면 약간 촉촉한 느낌들고요 밀림없이 싹 흡수되요
다쓰면 재구입의사있구요
꾸준히 계속 써볼거예요"
354,"남자지만 여성제품을 자주 이용하는데 
저한테는 잘맞는거 같아요
참고로 저는 건성이지고
아직 초반이라 확실한 평은 못하겠지만 지금까지는 만족합니다"
355,"프로폴리스앰플하구 같이 구매한 히알루로닉 더마 텐션을 같이 발라는데 (더 좋으라구..)ㅋㅋ
그것때문인지 아님 다른 이윤지 몰라도 밀림이  있어서
나중엔  프로폴리스만 바르니 괜찮앗어요.발림성 좋구 흡수도 잘되구 좋습니다."
356,엄마 드리면서 작은 것들은 나도 테스트 해볼까하고 주문했어요. 꿀의 달달한 냄새가 느껴지더라구요 워낙 좋다는 말이 많은 제품이라 이것저것 알아보고 믿고 구매했는데 보습은 괜찮은 것 같아요 엄마도 좀 더 사용해봐야 알겠다고 하셔요 겨울에 확실히 건조했는데 그 점은 이 앰플이 채워줘요
357,여칭 조공입니다 ㅇ ㅇ ㄷ 전 암것도 몰라유 힝힝~
358,추천율이 매우 높아서 구매하게 되었어요. 역시 왜 판매가 많이 되는지 알 수 있는 제품이었어요. 가벼운 에센스에 레이어드 용으로 계속 구매할 예정이에요. 앰플에센스 제품으론 요제품에 정착하려구요! 추천합니다!
359,"우선 세일할 때 저렴한 가격에 구매할 수 있어서 좋았습니다.
향도 마음에 들었어요!
예민하고 민감한 피부에 자극없이 사용할 수 있는 제품인 것 같습니다."
360,그전에는 얼굴이 심하게 당기는느낌이 많았는데 차앤박쓴 이후로. 얼굴 당김이 적어지는 걸 느끼네요 정말 좋은 제품인것 같아요 그리고 올리브 제품은 대부분 훈하면 미백과보습 자는데 탁월한 제품인것같아요 앞으로도 좋은제품 부탁드려요~~
361,라로슈포제 앰플 쓰다가 바꿔봤습니다  건조한 얼굴에 순하면서도 무겁지않게 발립니다   행사해서  용량까지 넉넉해서 만족합니다 여름까지 써볼예정입니다
362,"후기보고 엄마 겨울 보습용으로 사드렸는데 
엄마가 얼굴 만져보라면서 엄청 촉촉하다면서 괜찮다고 하셨어요 
제 에센스 다쓰면 이거 한번 발라보고 닥터지에서 갈아타려구용"
363,리뷰보고 구매해서 듬뿍듬뿍 바르고 있는데 아직은 눈에 띄게 체감할수 있을만큼은 잘 모르겠어요. 하지만 다소 건조한감은 많이 좋아진듯합니다. 꾸준히 한번 사용해보려합니다.
364,"꿀처럼 차르르 윤기나는 텍스처라 바르면 기분이 좋습니당..헤ㅇ
본제품은 저에게 다소 용량이 작은 감이 없지않아 있었는데 용량이 큰 기획이 나왔길래 얼른 구매했습니다 
쭉 팔았으면 좋겠어요~!"
365,매번 면세점에서 사다가 제품을 다 써가는데 추가구매를 어디서 해야할지 고민하고 있었어요. 때마침 올리브영에서 쿠폰도 주고 저렴하게 행사를 진행하길래 득템했습니다 ㅎㅎ 요즘 택배가 거의 지연된다고 하던데 배송은 거의 이틀만에 와서 너무 감사했어요
366,보습에 좋다고 해서 구매했는데 속 당김이 없어졌어요! 겨울에 쓰기 좋고 딱이네요~
367,몇주 썼는데 아직 확실히 뭐가 좋은지는 모르겠어요 ...
368,단독으로 사용해서 꿀 조합은 모르겠고 여름빼고 사용하기 좋아요. 피부 진정하기에 좋움
369,3년째 사용하고 있는 제품이에요 늘 만족합니당
370,씨앤피 프로폴리스 에너지 앰플은 뭔가 수분 보충 보다는 미백에 우선 효과를 좀 본 것 같아요! 바르면 흡수가 빠르게 되서 끈적거리지 않은 점도 좋고 가격대가 비싼 편이나..행사할때 잘 산 것 같아요! 뭔가 바르면 탱글탱글 해지는듯한 기분이 들어 바를때마다 기분이 좋아용
371,후기가 좋길래 써볼려고 삿ㅇㅓ여 일단 끈적임 없이 되게 쫀쫀하게 발립니다 계속 써봐야 알겟지만 괜찮는거 같아요
372,몇통째 사는지도 모를정도로 너무넘넘 애정하는템입니다❤️❤️
373,"기획제품이라서 양도 많고 세일도 많아서
이런좋은기회에 구입했어요"
374,7통째 쓰고 있는데 앞으로도 계속 애용할거 같아용
375,"갈색병에서 갈아타봤어요!
오늘 처음 사용해봤는데 좋은 것 같아요.
꾸준히 사용해보려고요"
376,유명해서 사봤습니다 많이 끈적거리지 않고 잘 흡수돼요
377,"앰플 뭘 사용하면 좋을까 하다가
차앤박 라인 워낙 유명해서 구매했어요!"
378,"이제 몇통째 쓰는지 기억도 안나요
꾸준히 계속 쓰고있어요 진정효과가 좋아오"
379,수분감도 좋고 항상 쓰는제품인데 이렇게 좋은 구성으로 판매를 해서 구매했습니다 차앤박 화이팅 화이팅 입니다 항상 구매하고있으니 기획상품으로 행사를 많이했으면 좋겠어요 화이팅 화이팅 입니다  더대용량으로 나왔으면 좋겠습ㄴ다 흡수도 잘되고 화장도 밀리지않았어요 친언니 친한친구한테도 항사
380,사계절 내내 사용하는 제품입니다! 트러블 예방이 되는 느낌이에요. 방송보다가 트러블에 좋다고 해서 사용하게 되었는데 이제는 이것만 쓰네요. 비슷한 다른 제품을 써봐도 프로폴리스 제품중에서는 이게 제일 좋아요.같은라인 크림도 추천합니다.크림은 좀 무거워서 겨울에 추천해요
381,효과좋음 여드름도 안나고 건성들한테 최고인듯 ㅜ
382,얼굴이 푸석해서 샀는데 저렴하게 많은 용량 살 수 있어서 좋네요~
383,항산화. 미백에 아주 탁월한 제품입니다! 추천해요~
384,"앰플 촉촉하고 좋아요~
처음 써보는데 피부가 좋아지는것 같애요~ ㅎㅎ"
385,"리뷰보고 기대하고 남편쓴다고해서 구입했어요~  아직 한달안썼으니, 드라마틱 효과는 모르겠고 꾸준히 써보고있어요"
386,"완전 고농축인 것 같아요
진작 살걸... 나이트 케어 마지막 단계에 듬뿍 올리고 자니까 속건조까지 싹 잡아주네용"
387,학생때 함부로 살 수다 없었는데 이번에 써보니 대박 ㅋㅋ진작 알바비로 살걸 그랬나봐요. 악지성인데 추천
388,저렴한 가격에 다양한구성 좋구요 건조피부에 촉촉히 잘쓰구있어요
389,"주문한지 한시간만에 받았습니다!
로켓보다 빠릅니다"
390,"원래 한겨울에만 사용했엇는데 
이제 여름빼곤 내내 사용할수잇을거같아요 ㅎㅎ"
391,후기가 너무 좋아서 믿고 샀어요 발림은 부드럽고 좋아요
392,앰플중에 최고의 앰플인것같습니다 브드럽게 발리고 레이저치료하고 후의 홈케어에도 만족합니다
393,앰플을 거의 사용하지않아서 한번 써볼까 구매한 제품인데 건조한 저에게는 괜찮았어요~그다음 크림단계 사용시에도 되게 잘 발려서 좋았어요
394,"차앤박하면 요 앰플이죠,, 겨울철에 좋아요 파데에섞어쓰면 물광"
395,저렴한가격에 구매해서 좋아요.... 에센스  다떨어져서 재구매했읍니다
396,끈적이지는 않고 보습감도 있어서 겨울에 사용하기 좋았어요. 지성피부는 여름에는 부담스러울것같아요.
397,할인뜬거보고 구매했는데 전혀 자극없고 쫀득하니 당김이없어요 재구매 의사있습ㄴ다
398,"워낙 민감하고 건조한 피부에 아무거나 막 못쓰는 피부타입이라 고민하다 구매햇는데 트러블없이 잘 맞네요~
흡수도 빠르고 촉촉하니 좋아요~"
399,이거만 찾는데 특별 기획으로 나와서 2개 지름니다
400,"친구한테 샘플 받아서 썼는데 생각보다 괜찮아서 세일하길래 샀어요. 속건조가 심하고 오후되면 기름종이 2ㅡ3장 써야할 정도로 기름이 올라왔는데,  이거 쓰고 난 후론 기름도 덜 돌고 건조한 느낌도 나아졌네요. 3방울씩 아침 저녁으로 쓰는데 작은 샘플 아직도 쓰는 중입니다.(2주 다 되감) 적은 양으로도 만족스럽게 쓸 수 있어요!"
401,"프로폴리스 성분에 반해서 
얼른 구매했습니다 
촉촉한 느낌이예요 ~
지속적으로 사용 후 알수있겠지요
아쉬운점은 양이 좀 작아요~"
402,"정말 신세계경험입니당 영증성 트러블에 특효인것같아요
끈적이지도않고 너무좋네요"
403,"저렴하게 올라와서 후기보고 처음 구매해봐요 
복합성인데 적당한 보습에 뭐 올라오지고 않고 일단 만족입니당"
404,"건성피부에 좋아요
저렴한가격에 좋은 상품 감사합니다~"
405,다른 앰플보다 좋아요 행사해서 더 좋고 저렴하게 샀어요
406,"대용량 기획으로 나와서 구입했어요.
끈적임이 없고 잘 흡수되서 좋아요
향은 연한 레몬향 정도라서 자극적이지 않구요"
407,저녁앰플구매할려고찾다가후기가좋아서구매했어요.한정기획대용량판매해서 구매했어요.득템한기분이예요
408,상품구성 너무 마음에 들어요~ 말이 필요없는 차앤박 최고의 앰플이잖아요 ㅎㅎ 발림성도 좋고 품절되기전에 빨리 쟁여두시는게 좋을 듯 ㅎㅎㅎ
409,보습은 좋지않은거같아요 그거빼곤 다만족합니다 처음엔좀끈적한데 시간좀지나니 ㄱㅊ네요
410,바르고 나면 엄청 쫀쫀해요 겨울철 수분에 좋아요
411,사실 1월 초에 구매했는데 1월동안 할인된금액에서 할인을 더 하길래 쟁여놨습니다! 그만큼 효과 좋구용 강추입니다! 구매하시려면 지금사셔야돼요!
412,기획으로 팔아서 하나 더 샀는데 너무 좋아오 !
413,샘플써보고 좋아서 본품 샀는데 역시나 좋네요!
414,할인해서  싸게 구매했어요 너무좋네요  많이파세요
415,건조할땐 항상 이 앰플 먼저 바르면 피부가 편해요 겨울엔 항상 바르는거 같아요
416,"와 차앤박 프로폴리스 앰플 사용한지 몇년째인데 이런구성에 이런 가격 첨인거같아요 ㅋㅋㅋ 사계절 내내 믿고쓰늠 차앤박!! 사랑입니다 ㅋㅋ 그리고 올리브영 오늘드림 배송 처음써봤는데 대박이네요 어제 저녁 11시 50분? 에 주문했는데 지금 도착했습니다 ㅋㅋㅋㅋ
로켓보다 빠른 오늘배송이라더니 진짜 로켓보다 빠르네요"
417,쫀쫀한 에센스 찾고있다면  추천합니다 비싸지만 행사로 좋은구성
418,프로폴리스제품은 사계절을 사용하고 있습니다. 이번에 기획세트가 너무 잘나왔네요~ 거기에 세일까지 고민없이 구입하고 쟁여넣었습니다.
419,"세럼이나 앰플은 정말 다양한 제품을 사용해보았는데 차앤박 앰플은 겨울에 쓰기 정말 좋은 제품인 것 같아요. 이번에 이렇게 푸짐한 구성이 나와서 싸게 많이 샀어요. 
묵직한 질감이면서도 흡수력이 좋아서 바르고 다음 날 보면 반짝반짝 광이 나고 끈적이지도 않게 흡수가 쏵 된답니다^^"
420,좋아여 처음엔 의심이 많았는데 바르다보니 촉촉행ㅕ
421,저번에 ㅇㅓ워즈 기획으로 미스트랑 같이 구매했는데 그때보다 구성도 용량도 많고 좋네요
422,"배송빠르게 왔어요!
바를때 살짝 따가운느낌은 받는데
그래도 바르고 나면 좋아서 한번씩 구매하게되는 제품이에요"
423,이거 진짜 제 인생 엠플이에요 다른거 좋은거 많이 써봣는데 꾸준히 오래쓰기엔 제일 좋은거같아요ㅠㅠ 다들 쟁이세요 ㅠㅠ~~~
424,워낙 쟁여두고 쓰는 아이템이라 이번 기획 제품 나오자 바로 구입! 명줄허전입니다 잘쓰고 있어요
425,"여름빼고 계속 쭉 써오는 앰플입니다.
건성분들이 쓰시면 좋아요"
426,자극없이 순하게 영양 공급하기 좋아요 다만 엄청난 보습감은 없어요
427,"구성이 넘넘 좋아요. 5미리3개, 15미리1개, 30미리1개 해서 총60미리 용량인데~ 가격도 그렇고 알차게 참 잘 나왔어요. 전에 어딜 가면,유리용기를 싸들고 가야해서 불편했는데~5미리짜리 남겨놨다가 나중에 여행가게 되면 쓰려구요^^  에센스나,앰플 좋다는거 써봐도 그냥 거기서 거기같더라구요ㅠ 그래도 차앤박꺼가 그나마 보습력은 괜찮은것 같아서 1년정도 딴거쓰다, 다시 프로폴리스로 재구매했어요. 바르고나면 광이 참 좋은데,광이 오래 못가긴해요ㅋㅋ 제가 아주 많이 건성이라서 그런것 같아요. 요제품은 겨울에 쓰기 넘 좋아요"
428,처음써보는데 좋은거같아여 촉촉하네영 저렴하게 구매해서 가성비 갑
429,"세안하고 스킨다음에 바르면 피부에 잘 스며듭니다.
항상 세일할때는 구매를 하네요.
건조하지 않습니다"
430,보들보들 좋아요 짱짱 떨어질까봐 얼른 또 구매했지요
431,겨울에 건조할때 보습용으로 쓰기 좋은거 같아요~세일해서 원래 가격보다 저렴하고 용량도 커져서 좋네요
432,"항상사용중인 제품이라 가격이 넘 착해 또구입했어요~
순하고 앰플중에 최고인것같아요.
항상 세일때 쟁여두고 쓰고 있네요.."
433,보습오일엔 이게 최고입니다. 꾸준히 구매하는 중이에용
434,"건성에 좋습니다
촉촉하고 하나만 발라도 꿀광나요
밤에 듬뿍 바르고 자는거 추천 드려요"
435,좋아요! 차앤박 프로폴리스랑 코스알엑스 프로폴리스랑 돌아가면서 사용하고 있는데 마침내 차앤박 대박세일을 해서 구매했습니당
436,차앤박 세일 잘 안하던데 세일해서 바로 샀어요 ㅋㅋ 이것만 20통 넘게썼어요 정착템이에요 꼭 사세요
437,최애 앰플 입니다ㅎㅎ 끈적임 없고 밀리지 않고 흡수 너무 너무 잘 되고 좋아요
438,"차앤박 프로폴리스 앰플 좋아요!
꾸준히 사용하게 되요-
지성피부에도 잘 맞습니다!"
439,사용한지 2년이 넘었어요 다른건 못써요ㅠㅠ 촉촉하고 잘 스며들고 끈적임없고 무겁지 않고 피부결 정리된 느낌도 들고 매끈해보여요
440,"아직 안써봐서 잘 모르겠는데, 워낙 리뷰가 좋은상품이어서, 기대가 많이 됩니다~ 좋은가격으로 자주 나왔으면 좋겠네요!"
441,겨울이 되면 늘 찾는 제품인데 기획으로 싸게 사서 만족해요.
442,세안 직후 발라주면 흡수도 빠르고 피부결이 정돈돼요
443,이거.. 몇년전부터 가끔 생각날때마다 써서 이제 한 여서 일곱통 썼는데 이거 쓰면 확실히 결이 달라져요 잊고있다가 다시 ㅆㅓ보니 또 좋아서 또 재구매해써요
444,"올리브영 화장품은 처음 써봤는데 괜찮네요~
처음에는 보습 잘 안되었는데
써보깐 괜찮네요~ 흡수력도 좋구요~
화장품 관련일 했었는데
드라마틱한 효과는 없지만 쏘쏘하게 쓸쑤있는것 같아요 ㅋ
선물용으로도 좋을것 같아요 ㅋ"
445,"이건 진짜 정말 최고인거 같아요...
세일할때 왜 더 안샀는지 너무 후회중이네요ㅠㅠ
닦토 후에 앰플 바르는데 너무 흡수 잘되어서 좋구요
향도 너무 좋고.. 기획상품으로 얼른 또 떠서 구매하고 싶을 지경이에요!!"
446,"얼굴이 다 뒤집어져서 이번에 대량으로 구매했어요.
좋아졌다가 나빠졌다가 반복하긴 하는데, 다른 수분 크림들보다 훨씬 좋네요 ㅠㅠ
벌써 세 박스 째인데, 피부가 얼른 돌아오길..."
447,꾸준히 사용하고 있는 앰플입니다! 제형은 피부에 쫀쫀하게 발리고 앰플이다보니 살짝 무거운거 같지만 생각보다 가볍게 발리고 촉촉합니다! 흡수도 잘되고 앰플바른 후 크림을 바르는데 밀리지도 않고 만족합니다!
448,일단 세일기간에 구입해보았습니다. 자극없이 순하고. 보습도 잘됩니다. 자기전에. 아침세안후에 바르면 얼굴에 광이 납니다. 겨울이나 여름에 사용에도 무겁지 않겠네요
449,"미국에 있는 딸에게 딸이 생겼읍니다.
아기 보느라 피부가 많이 꺼칠해 보이네요.
엄마 맘으로 한박스 구입해서 보냈읍니다.
딸이 좋다하면 2달후 갈때 더 구입 하려구요~"
450,"🌸피부타입: 복합성 (여드름,예민한 트러블피부)

✅ 저는 끈적이는 느낌을 싫어해서 그런지
이제품은 바르고 오래지나도 끈적거려서 쓰기 어려워요.
보습이나 흡수가 잘되는지도 모르겠고 ㅜ.ㅜ
프로폴리스가 안맞는 피부인거같네여.."
451,후.. 너무 좋아요.. 차앤박 프로폴리스 앰플 좋다는 얘기듣고 사봤거든요 다른 앰플 많이 써봤는데 제일 좋네요♡ 끈적이지도않고 딱 적당한 제형!!
452,비싸서 가끔씩 쓰던 앰플인데 이번에 할인해서 저렴하게 구입했어요. 촉촉하고 바르고 난 다음 화장도 잘 먹어서 아주 만족스럽습니다. 많이 끈적이지 않아서 더 좋아요.
453,앰플 하면 차앤박 앰플이죠!!! 다른거 써도 결국엔 차앤박 앰플로 돌아오는 것 같아요~~ 촉촉하고 보습이 잘 돼서 꾸준히 사용하고 있는 제품입니다 ㅎㅎ 기획세트도 잘 나와서 좋아요 좋은 가격에 더 대용량으로 만들어주세요~~
454,친구 추천으로 꾸준히 사용하고 있는 제품입니다. 바르고 난 후 끈적임이 적어서 아침이나 자기 전 둘다 쓰기 좋네요~
455,"떨어지지 않게 항상 재구매하는 제품이에요
특히 가을 겨울 시즌에는 여유분까지 꼭
구매해요
이렇게 증량기획이 나올때는 무조건 구매!"
456,건조한 피부에 사용하면 좋아요.  15ml 사용하고 좋앙서 대용량 구매 다시 해서 사용합니다.
457,"발림성 다 좋음 ㅇ복합성에 여드름, 모공이 고민인 피부인데 크게 뭐가 달라진 지 잘 모르겠어용"
458,늘 사용해왔던 앰플입니다. 밤에 자기 전에 바르고 다음 날 아침에 완전 탱탱한 꿀피부가 돼요.
459,"피부과에서만든화장품이라믿음이가고,지복합성피부라서날씨가쌀쌀해지는늦은가을부터겨울에쓰기좋은에센스에요!!
확실히촉촉해지고피부가땡기지않아서만족합니다!!"
460,"지금까지 써본 앰플 중 최고!
흡수 좋고 번들거림 없어요!
촉촉함이 바로 느껴져요
3통째 구입!"
461,겨울에 이거 안써주면 뭔가 부족한 느낌이 들어 꼭 써줍니다. 피부 컨디션이 좋아지는 느낌이 들어요
462,역시..믿고사는 차앤박 앰플이쥬 좋은 구성인지라 세박스 쟁여놨어요^.^ 악건성인데 요거 꼭 바르고있답니당
463,"믿고 쓰는 차앤박 프로폴리스 앰플입니다 !! 겨울에 얼굴 건조 할 때 쓰면 하루종일 히터 앞에 있어도 갈라짐 없ㅇㅓ요!! 건성 김미연 분들 다들 쟁이세오., 이게 제일 좋ㅇㅏ요 10통 넘게 씀"
464,"쫀닥쫀득하게 얼굴에 붙어서 스며드는 점이 좋습니다. 민감성 피부도 자극없이 사용할 수 있어서 비싸지만 아낌없이 발라주고 있습니다. 작년 여름, 겨울철에도 사용했는데 좋아서 주기적으로 사용하는 중입니다."
465,용양이 ㅁ조금 작은게 흠이지만 그래도 너무 좋아요 ㅠㅠ 비싼게 흠이라지만 할인할때 무조건 쟁여야
466,생각보다 끈적거리고 바르고나면 의외로 건조한것같고 이거 쓰고나서부터 뾰루지가 나서 좀 쉬려구요 발림성이 좋은데 몬가건조해요
467,자극없이 순하고 흡수도 잘되고 향이 은은하니 독하지않아 맘에 들어요~ 적극추천하며 앞으로도 재구매할겁니다
468,상품평이 너무 좋아서 세일할 때 두 세트 샀어요. 드라마틱한 효과는 아직은 모르겠지만 촉촉해요.
469,"수분감은 완전 충분하고. 시간차를 두고 두번이상 바르니 흡수가 잘되었습니다.
크림과 같이 사용하니 효과가 좋아요 
적극추천입니다"
470,믿고 쓰는 차액박입니다. 그렇지만 아직 사용한지 1달도 되지 않아서 효과는 잘 모르겠지만 흡수력은 좋은거 같아요
