,0
0,"화장품 성분을 꼼꼼히 살피는 구매자는 아니지만, 하필이면 최근 피이지 성분에 대한 기사를 접한 후라 해당 성분이 눈에 띄더라구요
프로폴리스 등 좋은 성분을 믿고 구매했던지라 피이지-8 성분이 함유되어 있다는 점이 조금 아쉬워요

< 피이지-8 성분에 대해 검색한 내용>
화장품 속 성분이 진피층까지 침투하도록 돕고 피부를 부드럽게 하는 역할을 한다
그래서 유화제나 계면활성제로 많이 쓰이며 세정력과 발림성에도 크게 기여한다
PEG뒤에 붙어 있는 숫자가 분자량을 뜻하며 수가 적어질수록 피부흡수율이 높아지기 때문에 PEG-100보다는 PEG-8성분이 피부에 더 잘 흡수가 되고, 흡수가 잘되는 분자량을 가진 PEG성분은 주로 크림류에 많이 사용되고 있다
해당 성분은 미국 비영리 환경시민단체에서 측정한 성분안전도 척도에 따라 3~6등급 사이의 보통 수준으로 확인이 되었으나, 최근 연구를 통해 알려진 사실들에는 피부의 수분손실률을 높이거나 피부자극을 유발하여 트러블 등의 부작용이 발생할 수 있다는 점이 밝혀져 사용기간 및 사용법 등에 유의가 필요하다

물론, 후기도 좋고 저 또한 자극이 생기거나 하지 않고 발림성, 사용감 등 맘에 들어 구매한 용량을 다 쓸 계획입니다
다만, 제 피부가 점점 민감성 피부로 바뀌는데다가 알레르기증상도 몇 번 경험해 본지라 장기간 사용을 할 땐 주의가 필요할 것 같아 기재해 보았어요"
1,"타사의 프로폴리스 엠플을 구매할 때 후기마다 차앤박 프로폴리스 엠플 이야기가 적혀있어서 그때 처음 이 제품을 알게됐어요.
진짜 유명한 제품인가보다 하고 한번쯤 사보고 싶다고 생각하다가 가격이 비싸서 쉽게 사지 못했었거든요.
📍근데 제 값주고 사도 하나도 아깝지 않을 것 같아요ㅎㅎ.
바를 때 빨리 다 쓰고 다른 거 사고 싶다는 생각이 들었던 제품들도 있는데 이건 쓸 때마다 기분이 좋아요.
✏️코xx엑스의 프로폴리스 엠플이랑 비교하자면 차앤박 제품이 더 되직한 제형이에요.
그래서 저는 되게 만족했어요. 여름이 되기 전까지 건조한 겨울, 봄에 사용하기에 좋을 것 같아요.
✏️지성이신 분들은 토너 다음단계로 여름에 이거 하나만 발라도 될 것 같아요😺
✏️제형 자체가 조금 되직하다보니 한두방울로는 얼굴 전체를 도포할 수 없더라고요. 그래서 저는 양쪽볼에 2방울씩 최소 4방울은 올리고 얼굴에 발라줘요. 4방울 올리면 살짝 아쉬운듯이 얼굴 전체에 발라지더라고요.
✏️바른 후에 마무리감은 쫀쫀해요. 유분감이나 부감감이 느껴지지는 않고 그냥 속건조를 확실하게 잡아주는 느낌이라고 하는 게 맞는 것 같아요🙆🏻"
2,"겨울 보습,진정,꿀광의 끝판왕~~~!!!

매년 겨울은 이 제품으로 보내는 것 같아요!!ㅎㅎ
악건성에 민감한 피부라 어떠한 보습 좋다는 앰플을 발라도 금새 건조해지는 피부인데요.
차앤박 프로폴리스 앰플 2번 레이어링 해주면 정말이지 속건조 잡는데 최고랍니다!!! 속피부는 물론 겉으로 보이는
피부는 기름 광이 아닌 피부 좋아보이는 사람들한테서 나는 듯한 그런 빛이 나요 ㅎㅎㅎ
저는 너~~무 건조해서 여름 제외하고 앰플을 사용 하는데요. 차앤박 프로폴리스는 건성이신 분들은 저처럼 여름 제외하고 내내 사용하시는거 추천합니다.
앰플 구입하면서 차앤박 액티브 프로폴리스 크림도
같이 구매했는데요. 완전 찰떡궁합이에요.
두 제품 같이 바르면 당기지 않아요.
그리고, 앰플은 2번 바르시는거 꼭 추천합니다^^
아까워도 1번 발랐을때보다 느껴지는 보습감은 2배가 넘어요.ㅎㅎㅎ"
3,한달 지난 후기를 올려봐요~ 볼쪽은 건조한 편인데 처음 발랐을때는 피부가 건조하고 예민해져 있는 상태라서 그런지 따갑게 느껴졌어요~ 계속 바르다보니 따가운건 사라지더라구요~ 수분감이 충분할거라고 느껴져서 구매를 한건데 보호막이 생긴다는 느낌보다는 시간이 지나니까 건조해 진다는 느낌이 들더라구요~ 아무래도 앰플 후에 수분크림까지 덧발라주지 않으면 충분한 수분감을 느끼기는 어려운것 같아요~제가 겨울철에 극심하게 건조해지는 피부라서 그럴수도 있을것 같아요~ 사람마다 피부 타입이 다르니 건조하신 분들은 이제품으로 만족하기는 힘들듯 합니다~
4,"🐝🍯01월 08일에 구매 후 재구매 후기🐝🍯

8일에 구매해서 딱 이주정도 사용해봤는데 너무 좋아서 대용량 기획 저렴하게 나왔을때 꼭 추가로 구매해놔야겠다 싶어서 할인기간 끝나기 전에 재구매했어요!

그때는 그냥 쫀쫀해지는 피부에 만족만 한 정도였는데,
피부가 완전 뒤집어졌던 상태였는데 속보습 채워주면서 피부결도 진짜 많이 좋아졌고 좁쌀들도 전부 들어가서 말 그대로 꿀피부가 됐어요!🍯🍯
프로폴리스가 항염 항균 효과가 있다고 하던데 정말인것같아요 ㅎㅎ 저는 ✔️복합성 피분데 그렇게 무겁다고 느껴지지도 않아서
✅토너-앰플-수분크림✅순으로 사용하구있구요
저희엄마는 ✔️건성피부라 ✅토너-앰플-무거운 탄력크림✅순으로 이 앰플 사용중인데 엄마도 겨울인데 하나도 피부가 건조하지않다며 앰플 세일할때 쟁여놓자고하셔서 재구매했습니다!💛

정말 피부타입에 관계없이 프로폴리스성분에 거부반응만 없으신 분이시라면 꼭 한번 사용해보시길 ⭐️강추!!⭐️드릴게요ㅠㅠ🐝🐝
사진에 피부는 차앤박에서 나온 문나이트팩과 앰플을 함께 사용해봤는데 요 팩이랑 앰플 함께 사용하는 꿀조합도 추천드립니당 ㅎㅎ 아침에 피부가 부들부들하고 매끄러워져요!🍯

딱 한가지 아쉬운 점이라면 2주썼는데 거의 반정도 사용한게 제가 복합성 피부라 많이 사용하지두 않고 저녁에만 발라주는데 15ml를 한달이면 다 쓸것같아요ㅠㅠ앞으로도 이런 대용량기획, 세일 많이 해주세요ㅠㅠ!

여름에는 그냥 가볍게 토너랑 가벼운 로션정도만 발라주는편이라 
앞으로 여름까지는 꾸준히 사용할것같아요!
인생템 찾아서 너무 좋습니당😍"
5,고영양앰플인데도 다른 앰플과 달리  끈적임없이 덜하고 완전 피부에 영양을주는 느낌이에요~피부에 광도  나는듯 하구요~다음날 아침에 다른제품을  사용할때보다 더 촉촉하고 탱탱한게 느껴 지더라구요~~단품으로 구매해 쓸때는  곰방 달아졌는데 최초 구성인 대용량기획으로  구매해 사용하니 오래쓸 있어 든든한 기분이네요!!!.갠적으로  원래 프로폴리스랑 홍삼  성분이 들어간 제품은  피부에  잘  맞지 않는데 cnp프로폴리스앰플은  피부에 전혀 트러블은 커녕 자극도  없드라구요~요즘같이 건조한 날에 아침 저녁으로 꾸준히 사용하니 얼굴에 생기가 도는 느낌 입니다.
6,"새해가 되면 차앤박 프로폴리스 에너지 앰플 사기 가장 좋은 때가돼요. 항상 요맘때 특별 기획에 세일까지 하더라구요. 올영 너무 감사합니다 ㅎㅎ
요 앰플 좋은건 두말하면 잔소리죠~
저처럼 메마른 건성 피부에게 촉촉함와 윤기 영양 모두 주는 앰플이에요. 
가격이 사악해서 맘은 아프지만 쓰면서 정말 좋다는 느낌을 팍팍 받아요. 
30+15+5*3 미리 라는 핵이득 용량을 이 가격에 구매할수 있어 안살수가 없었고요. 
세안 후 토너나 토너패드로 피부결 정리를 한번 하고요
요 제품 톡톡 떨어뜨려 두드려주면 이것만으로 영양 다했다 싶어요. 그래도 저는 같은 라인의 프로폴리스크림까지 발라주는데요. 정말 얼굴이 쫀쫀해져요. 환상의 궁합이에요. 이 제품 바르면 확실히 피부에 건강한 윤기가 돌아 피부 좋아보인다는 말을 자주 들어요. 
좋은 제품 대용량으로 잘 구매했네요~👍"
7,"올영에서 에센스하면 차앤박 프로폴리스 에너지 앰플이
좋다고 많이 들었는데 왜 유명한지 알 것 같아요.
2주 정도 사용해보고 후기를 올릴까 했는데 ⭐️바르고 다음날 피부가 부들거리는걸 느끼고⭐️후기 써요.

✔️피부타입 : 지복합성

✔️기존에는 파란병 에센스를 사용했는데 그게 쫀쫀하면서도 머리카락도 붙고 약간 마무리감이 끈적여서 아쉬웠는데, 차앤박 앰플은 수분감이 느껴지면서 쫀쫀하게 채워주면서 흡수도 잘되고 끈적이지 않아서 좋아요! 

✔️대용량에다가 샘플도 들어있고, 상품 구성이 정말 좋아서 설 다가오는데 지인 선물로 준비하려구요ㅎㅎ"
8,"이번에 차앤박 프로폴리스 앰플이 대박구성으로 나와서 보자마자 구입했네요^^ 프로폴리스 앰플 중에서는 차앤박이 단연 으뜸인 것 같아요.. 

1) 제형 : 쫀득쫀득한 편이라,, 저는 앰플은 그래도 쫀득쫀득해야 된다고 생각합니다. 피부에 촵촵 닿으면서 바로 흡수가 되서 영양감 충분히 느껴집니다. 

2) 향 : 향은 무난해서 바르는데 거부감이 없어요. 

3) 용량 : 총 60미리가 구성되어 있는데 15미리짜리 미니어쳐는 외부 숙박 시 너무 좋을 것 같아요. 

4) 효과 : 단기간 드라마틱한 효과는 없지만 차츰차츰 주름 이 아주 미세하게 흐려지는 느낌이 있네요,"
9,"알레르기나 유해 성분이 하나도 함유되어 있지 않은 순하고 보습력 좋은 프로폴리스 앰플입니다. 지금 5통째 사용중이고, 가격대비 성능이 좋아서 계속 쓰고 있어요. 지금 팔고 있는 제품 구성이 싸서 3개 쟁여놨구요. 조만간 친구 생일인데 이거 선물해주려고 해요.
속 당김이 심한 건성 피부인 제가, 겨울철마다 페이스 오일로 겨우 수분감을 유지하던 제가! 이 제품을 만난 이후 페이스 오일을 쓰지 않아요. 그 정도면 정말 보습력 인정해줘야 합니다. 향도 부답스럽지 않게 은은하고, 쫀쫀하게 탄력 케어도 가능해 꾸준히 써볼 것을 추천합니다. 타사 제품에 비해 프로폴리스 성분이 많이 들어있어서 여드름 나는 것을 막아준다고 해요."
10,"겨울 보습때문에 제품 찾다가
차앤박 에너지 앰플 리뷰가 좋아서 처음 구매했어요~!

일단 향은 허니향이 은은하게 나요!

저는 수부지 트러블형 피부인데 트러블 전혀없었고 잘 사용 중이에요!

1. 제 개인적인 생각은 여름보다는 겨울에 사용하기 좋을 것 같아요 여름에는 끈적임이 많아서 자주 사용하지 않을 것 같아요!

2. 바르고 나면 윤기가 나서 수분을 채워주는 막이 형성 되는거 처럼되어서 좋습니다

3. 사용안할때 할때 차이를 크게 느꼈는데
확실히 이거 바르고 화장을 하면 달라요 화장을 잘 먹어요!

4. 에너지앰플 미니사이즈로 들어있는 기획상품이라 여행용으로 챙겨가기 좋아요

다음에 또 구매할게요"
11,"하도 유명해서 써보기도 전에 알게되는 제품이죠~근데 가격대가 있어서 살까말까 고민하다가 샀는데......너무기대를 했나보네요ㅎㅎㅎ악건성이라서 그런지....그냥 오래가는 느낌이없어 왜사라질까요ㅎㅎㅎ피지오* 크림제품이 더오래가고 촉촉한 느낌이네요.....고가의앰플인데 불구하고 지속력이 너무약해서 큰기대하고 쓰려하시는분은 작은거사서 써보시고 대용량으로 사시길 추천드려봅니다~~
할인할때 사서 그나마 덜아까운 느낌을 지울수가 없네요ㅎㅎㅎ그래도 잘쓰시는분이 훨씬더많은걸로 알아요~~
쫀득해지는 느낌을 생각했는데 전혀 그렇지않아서 그런거 생각하셨던 분들이시라면 실망하실수도 읺을것같아요~~암튼 너무큰기대 안하시고 바르시면 만족할수있을것같아요~오래촉촉하게 유지되었음 했는데 그거빼면 그래도 보드랍게 발리고 향도 없고 자극적인 느낌 전혀없어서 좋긴한거같아요^^흘러내려서 눈따갑고 이런 느낌도 전혀없어요~남은거 다쓰면 다시 구매할것 같진않습니다ㅡㅡ제가너무 건성인게 문제이겠지만요~~쓰던 피지오* 크림 아이들이랑 쭉쓸듯요ㅎㅎ"
12,나왔다 프로폴리스 앰플 중 내 인생템.. 진짜 좋아요 타사의 프로폴리스 앰플과는 비교가 안됩니다 ㅠㅠㅠ 원래 코스알엑스 프로폴리스 앰플을 썼었는데 그 제품과 보슥력을 엇비슷한것 같은데 뭔가 프로폴리스 그 특유의 꼬순내가 안나서 프로폴리스 앰플을 쓰는 느낌이 잘 안나더라구요 ㅎㅎ 그래서 돌고돌아 다시 차앤박 프로폴리스 앰플로 정착하게 되었습니다. 물론 가격은 용량대비 사악하지만 저는 다시 프로폴리스 앰플을 사더라도 무조건 차앤박 제품을 구매할것같아요 .. 너무 좋으니까요 흑흑 아예 대대대 용량으로 만들어서 파셔도 잘팔릴것같아요 ! 지금 용량은 넘작아용
13,기초단계에서 앰플이나 에센스는 꼭 챙겨서 바르는 편이에요~~ 그래서 항상 어떤제품이 잘 맞는지 이것 저것 써보는 편인에 이제품은 정착한지 몇년 된것 같아요~~ 가끔 궁금해서 다른 제품 사서 써보기도 하는데 이제품이 보습은 갑인거 같아요~~ 우선 향이 자극적이지 않아서 부담스럼지 않고 발림성도 좋고 미끄덩 거리는거 없이 잘 스며들어여~~  속당김이 심해져서 고민이었는데 프로폴리스 앰플 사용한 뒤로는 당김 증상(피부 건조함)이 진짜 많이 좋아였어요~~ 이제품 정착입니다~~ 기획상품으로 나온거라서 작은 사이즈도 같이 들어있는데 파우치에 넣어서 다니기에도 너무 조아요~~
14,"아이유님이 광고하는 곳이라 처음 접하게 됐는데
사실 엄청난 피부 변화를 느낀적은 없어요~~
하지만 장점이 많아서 추천합니다
👉장점👈

👉첫번째
가볍게 쓰기 좋아요~~
저는 뭐가 잘 나는 피부라서ㅠㅠ 쓰는게 조심스러운데 이거 쓰고 뭐가 난 적이 없어요~~

👉두번째
보습할 때 좋아요
겨울에 스킨토너 하고 나서 이제품 사용하고 로션 바르면 촉촉함이 오래가서 좋아요~~

👉세번째
영양이 필요할 때 저녁에 쓰면 아침에 썼을 때 피부가 좀 화사해요~~ 피로한 날에 쓰고 자면 확실이 아침에 좋아지는 걸 느낄 수 있어요~~
 
👉네번째
구성이 다양해서 휴대하기 편해요~~~~~"
15,"민감성 건성 / 30초 여

차앤박의 시그니처 에센스라고 할 수 있는 프로폴리스라인!
진짜 너무 써보고 싶으나, 가격깡패라는 이유로 항상 장바구니에 담아놓다 보내주기만 한..제품! 드디어 사용해봤어요~

기본정보
- 제형: 용기에 담겨있을때 투명한 꿀같은 색의 에센스 같은데 손에 얹으면 투명한 액체( 음 가볍게 흘러내리지만, 살짝 미끌미끌한 앰플) 무겁지 않으면서도 가볍게는 느껴지지 않는 애매한ㅋㅋ
- 향 : 음 살짝 단 향 일거라고 생각했으나, 달달한 향은 아님 그렇다고 향이 없는건 아닌데 뭔가 살짝 쉰 꿀 같은 느낌?ㅋㅋ

느낀점 : 너무 좋다는건 많은 후기와 주변인들의 소개로 알기는 했지만, 진짜 할인 안할때는 ML 계산하면 로드샵에서 이 가격의 에센스를 꼭 사야하는 현타가 올 때 있어요. 할인도 자주 하는것도 아니고, 기획도 엄청 자주 다양하게 나오는게 아니라 약간 로드샵에선 넘사벽인 브랜드..허허 근데 이번에 기획이 넘나 좋아 탑리뷰어 이벤트로 좋은가격에 구매ㅠ 드디어 한번 써봤는데 확실히 왜 좋은지는 알 것 같아요! 제형으로 봤을땐 보습에 별로 가까운 제형이 아니었는데 확실히 발랏을때 보습감이 오래가는걸 느끼네요. 근데 약간 처음  발림감이 미끌거리나, 흡수는 빠릅니다 신기하네요.  그런데 흡수가 빠른 만큼 다 흡수되면 유분감이 남는 에센스는 아니라서 뒤에 충분한 보습크림을 발라주지 않으면 건조해짐이 올까 무서운 느낌.ㅎㅎ

추천: 내가쓰기엔 사실 좀 부담스럽고, 선물용으로는 괜찮은 제품! + 마무리감이 깔끔해 남성분들 중에서도 기초에 관심있고 건성이신 분들 사용해도 좋을것 같아요!"
16,전에 쓰던 기초화장픔이 다 떨어져서 뭐 살까 고민하다가 이 제품이 올리브영 1위라해서 한번 사봤어요. 몇번 써보니 왜 1위인지 알거같아용 ㅋㅋㅋ 피부가 엄청 예민해서 조금만 잘못발라도 금방 뒤집히는데 이거는 너무 좋아요!! 오히려 뒤집혔던 피부 다시 돌려주고 보습도 잘되고 마무리가 깔끔해서 진짜 넘 좋아요 ㅎㅎㅎ 요즘 건조해서 피부 엄청 텄는데 이거 쓴 후로는 각질도 안일어나고 피부도 안트고 오히려 더 좋아졌네용 ㅋㅎㅋㅎ 아직 많이 남았지만 다 쓰면 또 이거로 사야겠어욤 ㅋㅋㅋㅋㅋㅋ 너무 좋아서 앰플 필요하다는 친구들한테도 계속 추천중입니당-!!
17,에센스를 구입 하려고 다른 브랜드 제품 또 많이 살펴 보고 뭘 살 지 엄청 고민하다가 차앤박 팩을 너무 잘 써서 믿고 사용하는 차앤박.. 이번에도 믿고 엠플 구매하였습니다~에센스 대용으로 저녁에 바르고 자면 좋을 것 같아요~ 리뷰를 보니 기획상품이고 이런 구성이 흔하지 않다고 하여 고민하다가 바로 구매 했는데 구성이 좋은 것 같아요~ 작은 앰플은 여행용으로 들고 다니기도 좋을 것 같아요~ 처음엔 가격이 비싸다고 생각했는데 구성을 보니 가성비 좋고 기기에되어 나온 제품 같아요~ 득템한 기분이라 너무 기분이 좋네요! 쓰던 화장품 다 쓰고 나면 바로 사용해 보겠습니다!
18,"차앤박 프로폴리스 앰플 5년 이상 사용하다 일년 정도 쉬었는데.. 요즘 다시 열심히 사용중이에요ㅋㅋ
역시 앰플은 차앤박 프로폴리스 앰플!! 완전 촉촉!!~😍
앞으로 다시 쭉 사용할 꺼에요~^^

특히 요번 1월 구성은 다시 없을 구성에 가격이라 3세트 구매해서 사용하고 있어요~^^
총 60ml용량에 이 가격을 본 적이 없는지라~ㅋ

타회사의 프로폴리스 앰플도 사용해봤지만, 전 프로폴리스 앰플은 차앤박이 제일 좋아요!! 적당한 농도의 앰플이 영양감있게 촥 스며들고요. 바르고 나면 완전 꿀광~~👍👍
보습, 영양에 이 만한 앰플 찾기 힘들어요ㅋ
이 앰플은 어느 피부 타입이 사용해도 무난히 사용할 수 있을 것 같아요^^"
19,"프로폴리스 앰플 바르면 바르자 마자 수분광이 느껴져서 좋아요 피부좋은사람들 보면 뭔가 광나면서 유분기가 있는것처럼 보이는 건강한 광이 돌아 매끈해보이고 피부 좋아보여요~ 여기에 같은 라인에 크림도 있어서 발라보았는데 구지 같은 라인 안맞추고 다른 크림 발라도 건조함없이 느껴져 좋았어요
특히 이번구성은 용량이 좋아서 샘플같은 용량으로 5ml 세개는 주말 여행다닐때 챙기기 좋고  큰 용량은 아침 저녁으로 스포이를  이용해  듬뿍 바르고있어
전~👉꾸준히 발라서 좋은것 보다는 즉각적으로 느껴지는 효과가 좋아서 또 구입하게 되는것 같아요 그날 그날 피부 컨디션을 최고로 끌어주는 앰플입니다"
20,"몇통째 쓰고 있는 차앤박 프로폴리스 앰플인데 정말 자극없이 순하고 바르면 촉촉하면서 윤기가 나요~금방 스며들어서 찐덕거리지도 않고 건성인데 제피부에 아주 딱이고 큰 트러블 아직까진 없습니당!!더큰사이즈 나왓으면 좋겠어요ㅜ금방 써버립니다ㅜ가격대는 조금 있어서 세일할때 쟁여두는 편이고 겨울에 쓰는게 더 좋은거 같아요~~앰플에 너무 만족한지라 크림도 이번에 구매했는데 아직 같이 써보지는 못했습니다~~같이 쓰면 저같은 건성인 분에게는 딱일것 같아요~~아직 남아있는 크림이 있어서 이거 다쓰면 같이 써보고 후기 남기려구용!!앰플 쓴 뒤로 피부도 마니 매끈해지고 좁쌀처럼 종종 올라왔는데 이제 말끔히 사라졌어요~~왜 인기상품인지 알겠습니당^^정말 많은분들이 써봤으면 하는 앰플이에요~~그동안 여러가지 싸봤는데 그렇다할 효과나 만족은 못봤거든요ㅜ근데 이앰플로 바꾼뒤로는 정말 큰 만족을 하고 끊을수가 없을것 같아요~
가격이 조금 사악하지만 세일때 사면 괜찮아요!!고민하고 계신 분들은 그냥 바로 구매하시길!!정말 추천합니당!!"
21,차앤박이라는 브랜드 자체가 주는 신뢰감 다들 아시죠? 그 중 프로폴리스 에너지 앰플이 좋다고들 해서 저도 몇년전부터 사용하게 되었답니다. 저는 T존부위는 지성피부이고 나머지 부위는 건성피부인데요 이 제품은 한여름만 빼고 4계절 내내 바르고 있답니다. 아무래도 한여름은 수분제품이 낫지요. 그외에는 피부에 부담이 없고 흡수도 잘되고 꾸준히 사용하면 피부가 맑아지는 느낌이 드실거에요. 참고로 차앤박 프로폴리스 앰플은 같은 라인인 프로폴리스 쿠션 제품이랑 같이 사용하면 매끈하고 윤기있는 피부 만드실수 있을거에요. 이번에 대용량 버전 장기간 생산되면 좋을것 같아요. 계속 쟁이는중...
22,"✅ 저희 어머니에게 이제품 기획나왔을때 구매해서 선물을 드려 사용하고 있는데 좋다고 해서 재구매하였습니다.👏👏

✅ 60대 여성분이고 지성에 보습이나 피부탄력때문에 구매한건데 우선 발림성은 금방 흡수가 된다고 합니다, 자고 일어나서도 당김도 없고요😄👍

✅ 다만 꿀성분인가 암튼 끈적임이 조금있고 향이 그닥 좋지는 않는데 어머니는 거슬리는 정도는 아니라고 합니다. 호불호는 갈릴 거 같습니다. 가격도 저렴한 편이 아니라서 요렇게 기획제품이나 행사할 때 구매해서 쟁여놔야 겠습니다.

✅ 저희 어머니는 보통 한번만 바르는 게 아니라 날씨가 많이 건조하다 싶음 여러번 레이어드해서 바름 좋다고 하시네요~재구매 의사있습니다👍👍🤗"
23,"세럼, 로션 매번 바꾸다가 이 제품만 계속 사고 있습니다. 수분부족형지성이라 속에 보습이 채워지고 겉돌지 않는 제품을 찾았는데 속건조를 확 채워줘요. 지성이라 이거쓰고 선크림에 파운데이션 화장까지 하면 좀 기름지다고 생각할 수 있지만 걍 파우더 처리로 마무리합니다. 세인할때마다 쟹여놓는 제품이예요. 사계절 내내  아침, 저녁에 스킨케어하고 이거 하나만 사용해요. 엄마도 이거 한 번 써보더니 바로 좋다는 반응와서 엄마랑 계속 같이 쓰는 제품이에요.  어차피 자주 사용해서 빨리 없어지는 편이라 대용량크기로 자주 할인판매해주셨으면 좋겠네욯ㅎ"
24,"피부타입-트러블/예민함/복합성

돌고 돌아 다시 오게된 앰플입니다ㅠㅠ
요즘 마스크때문인지 피부가 예민했었는데 가장 피부 컨디션이 좋았을 때를 생각하니 이 앰플을 사용했을 때가 주위에서도 피부 좋다고 했을 때가 생각나서 마침 세일도 해서 다시 돌아왔어요ㅠㅠㅠ 
날이 건조해서 피부도 건조함을 느낄텐데 앰플이 진짜 아주 겁나 촉촉하고 보습도 최고라서 건조함을 못느껴요ㅋㅋㅋ역시 좋습니다~ 

자기 전에는 두번정도 레이어드해서 바르고 팩처럼 하고 자면 다음 날 피부 만져보면 촉촉함이 남아 있는게 느껴져서 겨울에 어울리는 앰플이라 생각해요! 최애템입니다!!"
